service_slug,city_slug,title,description,icon_name,emoji,position
pompe-a-chaleur,villeneuve-d-ascq,"Installation pompe à chaleur","Installation complète de votre pompe à chaleur par nos experts certifiés RGE",Zap,⚡,1
pompe-a-chaleur,villeneuve-d-ascq,"Réparation et dépannage","Diagnostic et réparation rapide de tous types de pompes à chaleur",Wrench,🔧,2
pompe-a-chaleur,villeneuve-d-ascq,"Entretien préventif","Maintenance régulière pour optimiser les performances de votre installation",Settings,⚙️,3
pompe-a-chaleur,villeneuve-d-ascq,"Devis gratuit","Estimation détaillée et personnalisée de vos travaux",Calculator,📊,4
chauffage,lille,"Installation chauffage","Installation de tous types de systèmes de chauffage",Flame,🔥,1
chauffage,lille,"Réparation urgente","Dépannage rapide de vos systèmes de chauffage",AlertTriangle,🚨,2