service_slug,city_slug,author_name,content,rating,location
pompe-a-chaleur,villeneuve-d-ascq,"Marie Dubois","Installation parfaite de ma pompe à chaleur. Équipe professionnelle et travail soigné. Je recommande !",5,"Villeneuve-d'Ascq"
pompe-a-chaleur,villeneuve-d-ascq,"Pierre Martin","Dépannage rapide et efficace. Prix correct et technicien compétent.",4,"Villeneuve-d'Ascq"
pompe-a-chaleur,villeneuve-d-ascq,"Sophie Leroux","Très satisfaite de l'installation. Devis clair et délais respectés.",5,"Villeneuve-d'Ascq"
chauffage,lille,"Jean Durand","Excellente prestation pour l'installation de ma chaudière. Service client au top.",5,"Lille"
chauffage,lille,"Anne Moreau","Intervention rapide pour une panne de chauffage. Merci pour votre professionnalisme.",4,"Lille"